{
  "mandate_id": "01940000-0000-7000-8000-0000000000a1",
  "story_ref": "STORY-123",
  "story_url": "https://tracker.example.com/story/123",
  "title": "Account settings: notification channels section",
  "acceptance": [
    "The user sees the list of notification channels, each with its own toggle",
    "A changed toggle is saved and survives a page reload"
  ],
  "frame": "Project Example, epic \"Account settings\"; target branch dev; checked on the customer's staging",
  "due": "2026-01-23",
  "issued_at": "2026-01-19T09:05:00Z",
  "issuer": "client-b"
}
